866|860|Костя|08.09.2010| Доброго времени суток! У меня проблема с ASUS P750. Телефон   думает   что к нему подсоединена проводная гарнитура даже тогда когда ее по факту там нет, вследствие чего говорить можно только с ней. Сколько будет стоить ремонт и сколько займет это времени. Спасибо. |1200 руб. |user866@mail.ru
867|860|Олег|06.09.2010|Не идет зарядка на Gloflish x600. Шнуры и зарядка исправны. Сначала долго то заряжался, то нет, потом вообще отказался. Примерно стоимость ремонта?|Примерно 800-1300 руб. |user867@mail.ru
868|860|Юлия|03.09.2010| Телефон Nokia 2650. При нажатии на некоторые кнопки на дисплее появляется не то, что ожидаешь - например, нажимаешь   4  , а появляется   1   (т.е. реально нажимается соседняя сверху кнопка). Можно что-то с этим сделать и сколько будет стоить ремонт? |Устранение даноой неисправности примерно обойдется в 300 руб. |user868@mail.ru
869|860|Геннадий|31.08.2010|Телефон Samsung GT-C3510. Самопроизвольно периодически выходит из сети МТС. Симку проверял на другом телефоне, исправна. При вызове со стороны абонента ему идет сигнал неответа с моей стороны, а я не получаю вызова и не оповещаюсь о том, что мне звонили.Что это за неисправность, стоимость ее ремонта и время ремонта|Может быть нескотлько причин, надо делать диагностику, диагностика бесплатная, примерная цена ремонта 800 руб. |user869@mail.ru
870|870|светлана|28.08.2010|здравствуйте. у меня тел нокиа 5800. при вызове с тел появляется сообщение ошибка подключения. и смс ки не приходят. в чем может быть дело|Телефон надо перепрошивать. Перепрошивка этой модели составит 1200 руб. |user870@mail.ru
871|870|Дмитрий|26.08.2010|Русификация Motorola starTAC:делаете ли и сколько будет стоить?|Этой модели уже 16 лет. Он в процессе русешки просто помереть может, потому что старичок. Не возмемся. А кто возмется тот напрасно так уверен в себе. |user871@mail.ru
872|870|Глеб|23.08.2010|Добрый вечер. Упал аппарат Samsung GT-C3510. После этого экран не горит, хотя внутри слышно, что звук есть. Сколько будет стоить ремонт?|2200.|user872@mail.ru
873|870|елена|22.08.2010|здравствуйте, самсенг e530, открываю крышки, а пол изображения сверху есть, внизу половина белая. я им уже не пользуюсь, но хочу скачать с него фото, а из за дисплея не получается. долго ли это по времени и цена? спасибо!|Выдернуть информацию с Samsung e530 обойдется в 900 руб. Сделаем в течении часа. Если возмете с собой флешку чтобы туда переписать информацию, то вообще будет замечательно, но можем и в текстовом редакторе на электронку скинуть.|user873@mail.ru
874|870|Юрий|20.08.2010|Здравствуйте.Скажите пожалуйста сколько стоит замена (полностью) корпуса(оригинал)на Nokia N85|Корпус на Nokia n85 стоит 1200 руб.+ работа по замене 600 руб.  |user874@mail.ru
875|870|mishka|19.08.2010|сколько будет стоить замена дисплея на  sony ericcson c902???|Загляните пожалуйста в наш раздел цены на ремонт сотовых телефонов. Там есть ответ. http://www.remmob.com/price/tseny_remont_sony_ericsson_c902/|user875@mail.ru
876|870|Сергей|18.08.2010|Доброго времени суток, на Sony PSP начали самопроизвольно срабатывать шифты(боковые кнопки) можно примерно определить стоимость ремонта?|Надо менять кнопочный шлейф PSP. Стоимость 900 руб.|user876@mail.ru
877|870|Жанна|18.08.2010|После хорошего падения телефона (samsung s8300 ultra touch) треснул дисплей и пропало изображение|2200 рублей и все сделаем. |user877@mail.ru
878|870|Alex|18.08.2010|Цена на ремонт указана с учётом запчастей?Замена шлейфа на sasmung d880 1200 руб.|Все цены указаны с учетом запчастей. |user878@mail.ru
879|870|эльдар|16.08.2010|у меня psp не крутится диск в нутре сколько это стоит|Менять привод 2200.|user879@mail.ru
880|880|Артем|16.08.2010|Добрый день, скажите, можно ли на нокиа Е71(серый) заменить корпус и кнопки и сколько это будет стоить?|1200 корпус+300 клавиатура+300 замена. |user880@mail.ru
881|880|Алексей|09.08.2010|Телефон LG KP501. Наступили на телефон, треснул экран(дисплей). на прием работает, Сколько будет стоить ремонт? Заранее спасибо|1800.|user881@mail.ru
882|880|андрей|06.08.2010|у меня телефон нокиа н 73 постоянно сам выключается даже когда его не трогаешь.в чем причина и сколько будет стоить ремонт|800 руб.|user882@mail.ru
883|880|Анастасия|05.08.2010|Здравствуйте, у меня тел Нокиа 6300, я незнаю что там призошло, но ни с того ни с сего, стал набирать при включении 999999....., на звонки ответить не могу, и сама позвонить тоже, может клава не работает?Дело в том что у меня совсем нет денег,но есть тел. Моторолла Е 398, могу ли я вам отдать ее за ремонт своего телефона?Спасибо|Придется еще  докинуть пару соток. |user883@mail.ru
884|880|Евгений|05.08.2010|Доброго времени суток! Трещина на экране при загрузки виснет, ETEN G500+|2500р.|user884@mail.ru
885|880|Борис|04.08.2010|Здравствуйте у меня не работают почти все кнопки на PSP 1000,а еще нужен новый джойстик.сколько будет стоить весь ремонт и сколько займет времени?зарание спасибо.|Кнопки как раз из за джойстика могут не работать. Цена вопроса 1200-1500 руб. за все вместе. |user885@mail.ru
886|880|наташа|30.07.2010|у меня такая проблемма, когда мне звонят , я слышу, а меня нет. это я так понимаю проблеммы с динамиком? телефон сони эриксон w910i . сколько будет стоить ремонт.?|Не совсем правильно, не с динамиком а с микрофоном. 900 руб. 40 минут. |user886@mail.ru
887|880|Алексей|29.07.2010|сколько будет стоить ремонт дисплея на se w580i появилась трещина при падении|1800. Делается в течении 20-и минут. |user887@mail.ru
888|880|Катюща|26.07.2010| Здравствуйте!На Самсунге D 980 не могу войти в меню-кнопки   пляшут  при нажатии на правую сторону меню.Войти так и не получается. Подскажите, в чем может быть причина и ориентировочная стоимость ремонта? Спасибо! |Менять сенсорное стекло. 2300 руб. |user888@mail.ru
889|880|антон|26.07.2010|здравствуйте! уронил телефон samsung полетела сенсорика, сколько будет стоит починка ???|От 1600 до 2300 в зависимости от модели вашего самсунга. |user889@mail.ru
890|890|Александр|26.07.2010|После падения телефона (Nokia N95)перестал работать встроенный GPS приемник. Спутники не определяются, пробовал разными заведомо рабочими программами навигаторами, которые до падения работали. Что может быть и сколько будет стоить ремонт.|Примерно 1200.|user890@mail.ru
891|890|Ира|11.07.2010|Здравствуйте,у меня SE Aino.много падал и клавиатура была залита,сдавала на диагностику,сказали нужно менять touch screen и шлефовку делать.в др городе в ремонте сказали,что деталей нет.появятся не скоро.пробовали вставить другие,но не подошли..через сколько они появятся или может у вас есть?|Найдем. 2300 составит ремонт. |user891@mail.ru
892|890|Илья|10.07.2010|Здравствуйте. Имеется КПК FS C550, не реагирует на кнопку вкл. При подключении зарядки - есть заставка (горы снежные) и подсветка кнопок, и всё. Возможен ли ремонт, и примерная стоимость?Спасибо.|Скорее всего накрылась кнопка вкл. Ремонт составит 900 руб. |user892@mail.ru
893|890|Анна|08.07.2010|Здравствуйте! У меня HTC 3450  постоянно пишет что нехватает памяти для выполнения задачи. Ск будет стоить увеличение памяти ?|Надо скорее всего перепрошить. 1200 руб. |user893@mail.ru
894|890|Андрей|08.07.2010|Здравствуйте! У меня htc tatto перестал реагировать на прикасание к экрану а так все работает,что может быть помогите,подскажите,стоит тратить время или нет.Заранее благодарю.|Надо посмотреть, но примерно расчитывать на 2300 руб. |user894@mail.ru
895|890|Вячеслав|05.07.2010|Здравствуйте!У меня Samsung I-900. При зарядке в полевых условиях перепутали полярность. Сейчас не включается, а при вставленном аккумуляторе - греется. Можно ли отремонтировать и сколько ориентировочно будет стоить?|Отремонтировать можно, но сначала придется делать бесплатную диагностику. |user895@mail.ru
896|890|Оксана|05.07.2010|Здравствуйте! У меня nokia X6. Сколько будет стоить замена сенсорной панели, сколько это займет времени и делается ли это в офисе на м.Римская?|Во всех офисах все одинаково делается и стоить это будет 2300 руб. |user896@mail.ru
897|890|Екатерина|04.07.2010|Здравствуйте, у меня телефон Сони Эриксон w760i , ему 1 год и уже второй раз ломается гнездо для зарядки...почему?и куда нужно обратиться для ремонта?|Ремонт составит 800 руб. Обратится можно в любой из офисов. |user897@mail.ru
898|890|Валерия|04.07.2010|Здравствуйте,у меня nokia 5530.На него пролили вино,перестал включаться и залило экран.Скажите пожалуйста сможете ли вы отремонтировать,сколько это будет примерно стоить и сколько примерно по времени?|Надо делать бесплатную диагностику. Разбег цены может быть большой от 800руб до 3000 руб. |user898@mail.ru
899|890|Антон|01.07.2010|Добрый день!При вскрытии повредил разъем дисплея на системной плате или сам дисплей в nokia 5530. Точно нужна перепайка разъема. Так же нужна диагностика системной платы и диспляе. Возможно это сделать у вас? Сколько примерно будет стоить?|Возможно, конечно. Если восстановить получится 1500, если менять 2200.  |user899@mail.ru
900|900|Дарья|30.06.2010|Здравствуйте, скажите, сколько будет стоить замена задней панели на Айфон 3g 8г? Белого цвета, желательно оригинальную. Если неоригинальная, то есть ли различия между оригиналом и неоригиналом?И возможна ли замена, если я приду со своей панелькой? Сколько будет стоить?Спасибо.|2500.  Со своей 1500. |user900@mail.ru