801|800|Роман|26.01.2011|Подскажите сколько будет стоить прошить тел. Samsung L 770?|Смена ПО 800 руб.|user801@mail.ru
802|800|Сергей|25.01.2011|Sony Erisson X1 разрядился в ноль и не заряжается!| |user802@mail.ru
803|800|Кирилл|24.01.2011|Добрый день, требуется замена корпуса на Nokia N91.(клавиши можно оставить старые). Сколько будет стоить работа, есть ли корпус на складе? С уважением Кирилл.|Работа по замене 800-1000 руб. в зависимости от качества. У нас такого корпуса на складе нет.|user803@mail.ru
804|800|Янка|24.01.2011|Здраствуйте,мой телефон пролежал ночь в сугробе,он сенсорный..сенсор не работает,что делать?| |user804@mail.ru
805|800|Лариса|24.01.2011|Не держится задняя крыщка тел. Самсунг-флер. Ремонт возмлжен?| |user805@mail.ru
806|800|Денис|22.01.2011|eten x650. После погружения в ванну сразу его разобрал, продул и просушил в течении суток. После включения сутки работал нормально, на следующий день отключились внешний и внутренний динамики. Все остальное работает.| |user806@mail.ru
807|800|Юрий|22.01.2011|Доброго времени суток! Можете перепрошить китайский айфон 4 на Android?|Только что если на китайский андройд. |user807@mail.ru
808|800|Маргарита|20.01.2011|Сколько будет стоить замена прошивки на sony ericson W595 и сколько времени на это.| |user808@mail.ru
809|800|Артём|04.01.2011| Здравствуйте!	У меня сломался мой SE W705. Поломка заключается вот в чём: не работает подсветка экрана. Все остальные функции телефона прекрасно функционируют. Но, когда включается телефон, если держать нажатой клавишу включения подсветка работает несколько секунд.  Иногда, в процессе работы подсветка включается на несколько секунд. Этот дефект произошел на следующий день после падения экраном вниз, в раскрытом состоянии. Перепрошивал телефон - не помогло. Со шлейфом я думаю, должно быть всё в порядке, все функции телефона работают, экран в их числе. Я думаю, что сломались   стекляхи  . Сколько стоит заменить их, или причина в другом? |Замена стекляхи 900 руб, может быть еще обрыв дорожек платы, мы и это сможем сделать, но тогда стоить будет 1200 руб.|user809@mail.ru
810|810|Дмитрий|04.01.2011|Здравствуйте! Можно ли заменить тачскрин на GSmart 1205? Сколько по времени и по деньгам?|К сожалению не помню размер тачскрина на 1205, надо приносить и будем подбирать, обязательно подберем цена вопроса 1800-2100. |user810@mail.ru
811|810|dilik|04.01.2011|здравствуйте замена акулятора в айфона 3gs сколько будет стоит?|Вместе с заменой обойдется в 1500 руб. Делается за 50 минут. |user811@mail.ru
812|810|Илья|03.01.2011|Скажите пожалуйста... Сколько будет стоить, заменить сенсор на китайском телефоне,Айфон Т2000?| |user812@mail.ru
813|810|Дмитрий|30.12.2010|HTC MAX 4G после сброса настроек не калибруется экран и запуск телефона дальше этой операции не идет.можете ли вы помочь?ударов не было,программ не грузил,в воду не ронялВозможно потребуется замена сенсорного стекла 3400 руб. А может быть проклейка сенсорного стекла 1800 руб. Замена ПО 1200 руб. Диагностика бесплатно.| |user813@mail.ru
814|810|Максим|30.12.2010|У меня такая проблема , дело в том что PSP сломался , загарелся красный экран с надписью (ошибка,обратитесь туда где вы его покупали) и после этого он не включается.Мы обращались ,нам сказали что дело в самой плате.Сможите ли вы его починить ? и за сколько?|Цена зависит конкретно от модели PSP. Надо делать диагностику, она бесплатная в течении часа.   |user814@mail.ru
815|810|Елена|28.12.2010|У меня телефон LG KP500 упал в воду. сколько стоит его починить?|Восстановление КР500 после воды будет стоить от 700 руб(в зависимости от повреждений). Точную цену можно будет назвать после бесплатной диагностики.|user815@mail.ru
816|810|Михаил Морозов|25.12.2010|Уважаемые Господа!Московский Клуб инвалидов-опорников  поздравляет Вас с наступающим Новым Годом, желает  Вам здоровья, душевного и телесного,  любви, счастья, доброты и производственных успехов, и обращается со скромной просьбой: не могли бы Вы рассмотреть вопрос о возможности  ремонта презентованного нам недавно телефона IPHONE (не включается и не заряжается).Спасибо.С уважением,Михаил Морозов, техн. директор(905) 55 22 153moscovit@rinet.ru| |user816@mail.ru
817|810|Василий|24.12.2010|Здравствуйте.Телефон - Nokia 8800 Arte (копия)Проблема - белый экран. Телефон работает, включается/выключается, звук есть, звонки проходят. В общем все функции телефона работают, но экран просто светится белым.Что это может быть ?Сколько будет стоить ремонт ?Возможно ли его отремонтировать на Пролетарской ?|Возможно замена шлейфа, ремонт будет стоить 1800 руб. Диагностика бесплатно. |user817@mail.ru
818|810|Михаил|24.12.2010|Sony Ericsson K790i - при подключении зарядного устройства не всегда происходит контакт. каковы цена и сроки ремонта?|Возможно потребуется чиска системного разъема 500 руб., а возможно замена разъема 700 руб.|user818@mail.ru
819|810|аня|23.12.2010|сколько будет стоить ремонт экрана на нокиа 5250 сенсор целый. телефон вышел недавно|Замена дисплея на нокия 5250 стоит 2800 руб.|user819@mail.ru
820|820|Алексей|20.12.2010|Здравствуйте.Хочу поменять на nokia n 95 (серебряный) корпус и клавиатуру. Есть ли эти запчасти у вас в наличии и сколько будет стоить вместе с работой. Спасибо.|Замена корпуса и клавиатуры 2200 руб.|user820@mail.ru
821|820|Денис|19.12.2010|Сколько будет стоить замена шлейфа на телефоне LG KF300? (при полном раскрытии изображение плывет или исчезает, при открытии на 90 градусов все работает нормально).Дается ли гарантия на работу?|Замена шлейфа 1200 руб. В течении часа. Гарантия месяц.|user821@mail.ru
822|820|Наталья|19.12.2010|В китайском телефоне nokia x6 треснуло сенсорное стекло,Дисплей не вредим...Сколько будет стоить замена,и сколько это займет времени???|Многие модели китайского X6 внешне схожие, но при этом сенсорные стекла могут отличаться модификацией. Замена сенсорного стекла приблизительно 2000 руб.|user822@mail.ru
823|820|Анна|16.12.2010|сколько будет стоить замена тачскрина, дисплея и корпуса для nokia n97 mini?все запчасти у нас уже есть.|Приблизительно 1000-1200 рублей в зависимости от качества корпуса и тачскрина.|user823@mail.ru
824|820|Александр|16.12.2010|HTC MAX 4G. Почти совсем пропал внешний звук. Через наушники все хорошо слышно.Возможна ли замена динамика в моем присутствии? Если - да, то сколько это стоит?|В течение часа 1400 руб.|user824@mail.ru
825|820|Анатолий|15.12.2010|Верту (копия) после установки и подключения сим-карты перестал включаться.| |user825@mail.ru
826|820|юля.|14.12.2010|У меня телефон Nokia и не срабатывают почему то кнопки. Подскажите пожалуста сколько будет стоить работа?|Ремонт клавиатурной подложки от 500 руб. Диагностика бесплатно.|user826@mail.ru
827|820|наталья|13.12.2010|Здравствуйте!я нечаянно постирала свой телефон Sony  Ericsson в стиральной машине.Телефон целый,не разбит.Сим-карта работает,карта памяти тоже в порядке.Но сам аппарат не включается.Скажите,пожайлуста,есть ли возможность восстановить телефон в такой ситуации?Если есть,то сколько времени займет ремонт и  сколько будет стоить максимальная стоимость ремонта?Заранее спасибо.|Цена зависит от модели. Восстановление после влаги от 600 руб. Диагностика бесплатно.|user827@mail.ru
828|820|Елена|10.12.2010|мой телефон LG KP500 упал в воду, у него работает звук, он включается, но экрана совсем не видно. Сколько рублей будет стоить такая починка телефона?|Замена дисплея 2200 руб. Плюс устранение следов попадания влаги от 500 руб.|user828@mail.ru
829|820|Роман|07.12.2010|Здраствуйте,такая проблема,не работает динамик внешний на SE W890i,сколько будет стоить ремонт???|Замена динамика 900 руб. 40 мин.|user829@mail.ru
830|830|Cергей|06.12.2010|Здравствуйте,samsung GT-s5230 замена сенсорного дисплея-сколько занимает по времени и на сколько гарантия?|В течении часа. Гарантия месяц.|user830@mail.ru
831|830|Артем|17.11.2010|Здравствуйте. А вы занимаетесь ремонтом с другими регионами? наложенным платежом ? и скажите вы высылаете запчасти ? если да то мне нужна основная плата на Nokia 6700c скка это будет стоит? Заранее спасибо!|Такой платы у нас нет|user831@mail.ru
832|830|Мария|15.11.2010|sony ericsson S500i экран не горит, то есть все остальное полностью работает: звонит, играет и т.д., а экран черный.Почему? Что нужно сделать? сколько будет стоить?| |user832@mail.ru
833|830|Андрей|14.11.2010|Сколько будет стоить и займёт времени замена телефонного динамика на glofiish x600, а также восстановление работоспособности клавиатурного блока на верхней части слайдера sony ericsson g705? заранее спасибо!|Замена динамика в течении часа, 1200 руб. А с G705 надо делать диагностику. Приблизительно 1800 руб.|user833@mail.ru
834|830|Ольга|12.11.2010|при вызове абонента звонок и отклик не слышно , что за причина , срок и стоимость работы ?|Замена динамика 800 руб - час.|user834@mail.ru
835|830|Татьяна|11.11.2010|Здравствыйте. Nokia 6131 с высоты 1 метр упал на асфальт. Упал на сторону, где находится кнопка включения. С тех пор никаких признаков жизни вообще. Можно починить?| |user835@mail.ru
836|830|Дмитрий|10.11.2010|Добрый день,Занимаетесь ремонтом PspGo?Есть ли у вас бесплатная диагностика?|Занимаемся ремонтом PSP всех моделей. Диагностика бесплатная.|user836@mail.ru
837|830|Вадим|10.11.2010|Здравствуйте! Развалилось колёсико регулятора громкости на ASUS p527. Сколько будет стоить его замена и в какие сроки производите ремонт. С уважением, Вадим.P.S.  Если ответите на мыло укажите адрес своего сайта.|Колесико заменить возможно в течении дня. Примерная стоимость 1500 руб.|user837@mail.ru
838|830|Сергей|09.11.2010|Phillips X550Необходима замена платы. (разъело дорожки хлором, попала вода из бассейна. После просушки телефон работал неделю.Цена ремонта?| |user838@mail.ru
839|830|дмитрий|08.11.2010|Добрый день.разбит экран у nokia c1000 (китайский с тв)сколько будет стоить замена экрана?|Если дисплей подберется, то замена будет стоить примерно 1600 руб. |user839@mail.ru
840|840|Екатерина|07.11.2010|Siemens S88 замена дисплея - если есть и сколько будет стоить?|К сожалению таких дисплеев нет|user840@mail.ru
841|840|Екатерина|04.11.2010|Треснуло сенсорное стекло на навигаторе Prestigio, требуется замена. Можете ли помочь и сколько будет стоить? Спасибо.| |user841@mail.ru
842|840|Александр|02.11.2010|Nokia E75. Поменять корпус (новый корпус есть) + не работают 2 клавиши на внешней клавиатуре.Сколько это будет стоить?| |user842@mail.ru
843|840|Евгений|31.10.2010|кпк gigabyte g smart s1205. лопнул тачскрин . дисплей живой  . тач работает на четверти экрана . сколько будет стоить замена тачскрина? я из нижегородской области!|Замена сенсорного стекла 2300 руб.|user843@mail.ru
844|840|Лилия|28.10.2010|Сколько будет стоить заменить зарядное гнездо (вроде оно не работает (не заряжается)) на Nokia 8800 carbon art? Написанно финляндия.| |user844@mail.ru
845|840|Света|21.10.2010|телефон не видит симку и звука неть сони эрикссон W880i и хочу корпус сменить. сколько это буит стоить???|Замена динамика 900 руб. Замена микросхемы отвечающей за симку 800 руб. Замена корпуса 1200 руб. Диагностика бесплатная. Если будете ремонтировать все сразу, то возможна скидка.|user845@mail.ru
846|840|nasty|20.10.2010|SAMSUNG GT-C3510 экран стал в квадратики, а не четкий как раньше(может это пиксели сбились или что с ним?)сколько будет стоить ремонт?|Возможно дело у Вас в дисплее. Замена 2400 руб. Может быть что-то другое. Диагностика у нас бесплатная.|user846@mail.ru
847|840|Юрий|18.10.2010|Здравствуйте. телефон eten x800. Поймал глюк, кнопки на левой стороне не работают, при включении будто нажаты или залипли. перепрошивка не помогает....|Скорей всего у Вас попадание влаги. Ремонт приблизительно будет стоить 1200 руб. В течении дня.|user847@mail.ru
848|840|Хельга|18.10.2010|Samsung i900 отходит контакт зарядного разъема (зарядка происходит только при удерживании под определенным углом). Необходима замена разъема? и сколько это будет стоить?| |user848@mail.ru
849|840|Нина|12.10.2010|Самсунг D900i вероятно шлейф надо заменить-экран не загорается.2 кнопки не работают.Сколько время и денег?Есть ли гарантия на ремонт?Спасибо за ответ!|Замена щлейфа 1200 руб. в течении 30 минут. Гарантия на выполненные работы 30 дней.|user849@mail.ru
850|850|Татьяна|09.10.2010|cony-ericssonz550i после нахождения в холодном помещении на даче,села батареи,после зарядки изображение пропало.Сколько будет стоить ремонт?| |user850@mail.ru
851|850|Юлия|30.09.2010|Здраствуйте, сони эриксон S500i, что то с разъёмом для флешки, телефон её не видет...Можно ли это сделать и какая цена ?|Конечно сделаем. Примерная цена 800-1500 руб. |user851@mail.ru
852|850|Илья|29.09.2010|Незабываемый полет e ten glofish m700 треснуло стекло,отошел сам переходник между шлейфом,работоспособность экрана конечно проверить не могу,цена и срок ремонта.|1800 руб.|user852@mail.ru
853|850|Ксайн|29.09.2010|ASUS A626. Пролежал на включенной зарядке полгода. После отключения пытался определить батарейку, не смог. После перезагрузки - бутскрин и завис. Работает только с провода, висит на бутскрине. Перепрошивка не помогла. На батарейке есть ~3 В.Нужен именно он, привык уже к нему ;)|1200  руб. и будет все в порядке.|user853@mail.ru
854|850|ОЛЕСЯ|27.09.2010|После хорошего падения телефона (Nokia N95) треснул дисплей и пропало изображение..но снаружи нет трещит..а если включить телефон видно внутри много трещинок на экране...сколько будет стоить замена?|2100 руб. |user854@mail.ru
855|850|Дмитрий|26.09.2010|В Nokia 1661 после падения перестала обнаруживатся симкарта,какова примерная стоимость?|800 руб. |user855@mail.ru
856|850|Дмитрий|24.09.2010|Здравствуйте уважаемый.У мне nokia 6500 Slide - треснул дисплей,подскажите пожалуста примерную стоимость ремона. Зарание спасибо!|1800 руб. |user856@mail.ru
857|850|дмитрий|21.09.2010|у меня Sony Ericsson w880 полетел внешний динамик не слышу вызова сколько стоит ремонт?|1000 руб. |user857@mail.ru
858|850|Любовь|18.09.2010| Самсунг дуос. Не работает вообще. не ронялал, не тонул. Камера перестала работать на 3-й день после покупки, потом начали   глючить   контакты, а потом и вовсе потух. Что можно с этим сделать? |Можно сделать 1600 руб. и 30 минут времени. |user858@mail.ru
859|850|Олег|17.09.2010|SONY PSP 1000С недавнего времени аналоговый джойстик ( кругленькая пимпочка ) - не корректно работает - персонаж бегает сам из стороны в сторонуСколько будет стоить ремонт?  Спасибо|1200 руб. |user859@mail.ru
860|860|Ольга|16.09.2010|Отдыхали на море, телефон Nokia 5530 был в сумке на берегу, начался шторм. Волна попала на сумку,чехол был немного мокрый. Сначала телефон включился,а на второй раз нет и вибрировал долго. Сколько будет стоить ремонт?|От 800 до 1900. Сделаем бесплатную диагностику и скажем точную сумму. После воды только такая схема. |user860@mail.ru
861|860|Андрей|15.09.2010|кпк gigabyte g smart s1205.после падения, на экране появилась хорошая трещина, изображение есть, но не всегда работают иконки на экране.возможно повреждены сенсоры.хотелось бы узнать стоимость ремонта.|1800. |user861@mail.ru
862|860|Роман|10.09.2010|сколько стоит замена дисплея на nokia e71 tv|1500. |user862@mail.ru
863|860|оля|10.09.2010|у сони эриксона HD при падении треснул экран но работает хорошо,сколько будет стоить замена|2200. |user863@mail.ru
864|860|Сергей|09.09.2010|Nokia N72 нет заряда аккумулятора. На зарядном устройстве индикация что заряд идет.На телефоне ни индикации ни заряда.|600 руб. |user864@mail.ru
865|860|Максим|09.09.2010|Пролил на Sony PSP 2000 воду, в меню было такое ощущение что зажата кнопка, сушил 3 дня ничего не изменилось, купил новый аналоговый стик и поставил, стик в меню вообще не работает, либо снова возникает проблемма с тем что в меню все время тянет влево. сколько может стоить ремонт?|1000 руб. |user865@mail.ru
