272|270|Светлана|12.01.2015|Здравствуйте! Не грузится Гелакси Таб 2 - при нажатии пуска+громкости - ничего не перегружается( при подключении к зарядке - показывает заряжающуюся батарею, 100% - и при включении зависает на названии модели(( Что делать? Данные терять не хотелось бы на нем!|Скорее всего надо перепрошить. Принесите посмотрим.|user272@mail.ru
273|270|Елена|12.01.2015|Здравствуйте. сколько будет стоить замена стекла дисплея телефона LG Nexus? Именно работа, стекло есть новое в наличии.Спасибо.|1300.|user273@mail.ru
274|270|Андрей|24.12.2014|Добрый день!Скажите! А есть в наличии дисплей (экрана) сенсорного стекла Sony Xperia Z3(черный) Compact. Если есть то сколько будет стоить замена+деталь?|Есть. Цена по сайту. Сделаем в течении дня.|user274@mail.ru
275|270|Юлия|20.12.2014|Здравствуйте. Остаток обрезанной для другого телефона симки застрял в гнезде, его попробовали вытащить, смогли только часть(Стоимость ремонта?|Заменить сим разъем. Надо знать модель телефона.|user275@mail.ru
276|270|Григорий|18.12.2014|"Здравствуйте. Требуется Срочная замена дисплея "" тачскрин"" для телефона SONY XPERIA Z3 COMPACT BLACK. уронил телефон, разбиля экран, пользоваться аппаратом не могу. HELP скоро Новый ГодС Уважением Григорий"|Без проблем.|user276@mail.ru
277|270|Сергей|11.12.2014|Сколько стоит замена дисплея с сенсорным стеклом в сборе на нтс one V| |user277@mail.ru
278|270|Пётр|26.11.2014|Здравствуйте.Нужна замена экрана(разбит)на Nokia Lumia 1520 .Какова цена ремонта,время ремонта?Когда можно будет привезти в Кузьминки?|Цена на сайте указана. Утром приносите, вечером уже сможете забрать.|user278@mail.ru
279|270|Илья|25.11.2014|На нокии с2-01 шлейф экрана припаян или нет? просьба ответ скинуть на мэйл.Спасибо.|Да.|user279@mail.ru
280|280|Любовь|24.11.2014|Скажите сколько стоит замена стекла планшета asus vivotab smart me400c?|Последний раз было 6000 с работой. |user280@mail.ru
281|280|Енлик|19.11.2014|Здраствуйте! подскажите пожалуйста у меня есть телефон LG KE800.Залила водой. Экран не горит. не включается. цена ремонта и где можно починить?|Надо делать бесплатную диагностику. В любом из сервисов.|user281@mail.ru
282|280|Евгений|16.11.2014|Возможна ли только замена стекла на смартфоне Филипс I928?| |user282@mail.ru
283|280|Дмитрий|12.11.2014|Здравствуйте!Ремонтом планшета с windows вы занимаетесь?Не включается планшет,вроде проблема с биосом.|Занимаемся|user283@mail.ru
284|280|Алексей|12.11.2014|На сайте определена конкретная цена за замену дисплея смартфону Леново Р780 - 4100 рублей. Однако по телефону мастер (м.Кузьминки) сказал, что цена за замену будет 4800 рублей, и при ремонте взял эту сумму. Объяснил тем, что закупка была по другой цене, а цены на сайте не актуальны и ориентироваться на них не стоит. Хотя выбор Вашей компании осуществлялся всё таки по сравнению цен сайтов. Нормальная ли эта ситуация в Вашей компании.|Пол года назад доллар стоил 32 рубля, щас 53. Из за этой нестабильности меняется цена закупки. Менять цены постоянно мы не в состоянии. приносим свои извинения.|user284@mail.ru
285|280|Станислав|08.11.2014|Проблема с телефоном Lenovo p780После неудачной прошивки не включается, возьметесь за решение проблемы? и сколько будет стоить?|Возмемся. Надо взглянуть.|user285@mail.ru
286|280|Данила|03.11.2014|Nokia 8800 разбит экран. Не включается. Что может быть? И сколько ремонт стоит?|Стоимость замены дисплея на сайте указана. А остальное надо смотреть.|user286@mail.ru
287|280|Екатерина|30.10.2014|Добрый день!Интересует стоимость и сроки замены дисплея sony xperia z3| |user287@mail.ru
288|280|Наталья|27.10.2014|Здравствуйте подскажите сколько стоит замена тачскрина на сони иксперия м2 дуал? есть ли он в наличии? если нет то сколько по времени займет ремонт?(вместе с ожиданием запчасти)|Замена сенсорного стекла на Sony Xperia M2 Dual D2302 стоит 1800 руб. За день сделаем|user288@mail.ru
289|280|Олег|20.10.2014|Здравствуйте!В телефоне Philips W737 при просмотре видео фильма перестал работать динамик. Звук отсутствует и при всех входящих звонках и сообщениях. При присоединении наушников все хорошо слышно. Видимо надо менять динамик? Есть ли у вас в запчастях  динамики на W737?|Динамик скорее всего накрылся.|user289@mail.ru
290|290|денис|19.10.2014|нокиа люмия 720 не работают нижние кнопки не реагируют?|Надо менять сенсор.|user290@mail.ru
291|290|Ян|11.10.2014|Здравствуйте. Мерцает и моргает экран на сони Z1. Это контроллер изображения? Нужно менять экран?| |user291@mail.ru
292|290|Алёна|05.10.2014|Здравствуйте! Разбит дисплей у Nokia Lumia 820. При подключении к ПК не обнаруживаются данные в памяти телефона и на карте памяти. Возможно ли как-то это исправить/перенести информацию с телефона без ремонта дисплея, и вообще, связано ли это?|Замена дисплея (экрана) Nokia Lumia 820 оригинал- 4500 руб. Изъять данные из телефона без ремонта - 1500 руб. в офисе на Павелецкой. Диагностика бесплатная.|user292@mail.ru
293|290|Виктория|05.10.2014|Здравствуйте!Телефон китайский Samsung Star 9930i. Временами пропадает звук при разговоре с собеседником, сначала появляется треск, потом все пропадает. Ни я, ни собеседник не слышим друг друга. Сколько буде стоить ремонт?|С такой проблемой необходимо провести бесплатную диагностику, после которой сможем сказать фиксированную цену.|user293@mail.ru
294|290|Сергей|02.10.2014|Здравствуйте. У Вас курьерская служба работает, на протяжении длительного времени телефон временно не доступен, перезвонить позже. Мне надо отремонтировать разъём питания Nokia 6070.| |user294@mail.ru
295|290|Владимир|29.09.2014|Добрый день! Купили Nokia E5, знаки препинания и символы на клавиатуре не совпадают с набираемыми. Похоже, попалась оригинальная клавиатура, с нанесенными русскими буквами. Знак @ справа от пробела, а должен быть на кнопке c буквами S/Ы. В общем, нужна такая клавиатура: http://mobiround.ru/catalog/c1637/b305/p8444/Есть ли в наличии? Замену оплачу (не по гарантии).|В наличии такой клавиатуры нет. Если принесете свою, то работа по замене будет стоить 500 руб.|user295@mail.ru
296|290|Михаил|26.09.2014|Аппарат Acer S200, проблеммы со звуком в наушниках (далекий звук голоса, эффект бульканья, буд-то добавлен эффект караоке). Наушники исправные и без наушников звук нормальный.Это гнездо менять надо или проблемма глубже?!|Да, возможно надо менять разъем наушников. Замена разъема гарнитуры Acer S200 - 1500 руб. Но лучше сделать диагностику для точного выявления неисправности.|user296@mail.ru
297|290|Елена|25.09.2014|Сколько стоит замена экрана (монитора, стекла) у планшета samsung galaxy note 10.1 n8000 (белый цвет) и телефона Nokia Lumia 625| |user297@mail.ru
298|290|Майя|22.09.2014|Добрый день. То туго то глючит сенсоор из-за того что упал планшет, трещинка на экране не сильно заметна при работе. Интересует цена на замену сенсора? на ремонт сенсора? на замену стекла? Планшет Surfer 8.31 3G|На эту модель Explay запчастей нет|user298@mail.ru
299|290|Бакыт|20.09.2014|Здраствуйте! подскажите пожалуйста, у меня nokia lumia900 клавища звука нажимается само сабой и всегда звук на нуле поднимаю не поднимается в экране отображается что звук на нуле?|Ремонт кнопки громкости на nokia lumia 900 будет стоить 1200 руб.|user299@mail.ru
300|300|сергей|17.09.2014|htc cha cha залил водойэкран не горит,по звуку включаетьсяцена ремонта и где есть запчасти| |user300@mail.ru