201|200|Павел|15.07.2015|Скажите, у меня треснул тачскрин на megafon login+ есть ли он в наличии в отделении м. Новогиреево? сколько стоит без замены и можно ли его заказать и каковы сроки?|В данный момент в наличии нет. Но бывают.|user201@mail.ru
202|200|Алексей|14.07.2015|Здравствуйте. На телефоне ZTE Geek2 не загорается экран, но на прикосновения реагирует. У вас можно починить?|Конечно можно. Приносите.|user202@mail.ru
203|200|Леонид|13.07.2015|Добрый день! Ремонтировал nexus 5 в мастерской на Кузьминках, не работал микрофон, в конце июня, мастер что-то поменял, но микрофон снова отключился через пару дней. Были в отпуске, а приехав, не могу обратиться по гарантии, мастерская ваша закрыта, контактов нет. Кто и как будет покрывать мою гарантию, доделывать мой телефон? Могу ли обратиться в мастерскую на Проспекте Мира?| |user203@mail.ru
204|200|Роман|13.07.2015|Добрый день! Имеется телефон Huawei Honor 6, в момент зарядки, в разъем на телефоне попала вода. Сразу отключили телефон, появился запах гари. Какое время телефон лежал выключенным, затем его включили, телефон работает, но больше не заряжается и не постоянно видит сим карты (иногда видит обе, иногда только одну). Хотелось бы унать можно ли его отремонтировать и сколько приблизительно это буде стоить? Заранее спасибо.|Контроллер питания скорее всего сгорел. 3500|user204@mail.ru
205|200|Мадина|09.07.2015|Добрый день!Fly Модель: BL3815? Телефон включается экран работает, но не реагирует на команды. Что случилось, подлежит ремонту, сколько стоит услуга?|Сделаем.|user205@mail.ru
206|200|Сергей|09.07.2015|Уронил телефон Нокия 920, стекло пошло трещинами но все работает. Сколько стоит ремонт и где это можно сделать?|Легко и просто. Ценник указан на сайте.|user206@mail.ru
207|200|николай|09.07.2015|Добрый день нужен корпус на мобиадо профессионал ЕМ|Корпуса нет, можно найти стекло.|user207@mail.ru
208|200|Алла Юрьевна|09.07.2015|"Доброе утро! Мне нужно отремонтировать Nokia 95 8gb, скорее всего повреждён шлейф, хотелось бы заменить корпус (имеется оригинальный корпус). Возможно ли это сделать в любом из ваших подразделений или только в каком-то определённом? Меня интересуют конкретно отделения у "" Павелецкой"" и ""Новокузнецкой""?С уважением, А.Ю. Клещёва"|Есть хороший корпус но не оригинал и шлейф. Все вместе с заменой 2000.|user208@mail.ru
209|200|Андрей|06.07.2015|Здрасти! На фотоаппарате Canon - ошибка объектива, объектив не работает - заклинило, выдвинулся а обратно на половину зашнл и не работает. Скоко стоит|3500|user209@mail.ru
210|210|Герман|15.06.2015|Есть ли возможность срочно заменить стекло на Nokia 808 через курьера. Продолжительность и общая стоимость?|2000 +курьерские. За день.|user210@mail.ru
211|210|Вячеслав|09.06.2015|Замена дисплея Pocketbook 360 сколько стоит и возможен ли ремонт м.Коломенская|3200 за день.|user211@mail.ru
212|210|Александр|08.06.2015|Добрый день!Прошу уточнить: возможна ли работа с юр.лицом по договору (оплата по безнал.расч.). Работаете ли вы с НДС?| |user212@mail.ru
213|210|Александр|08.06.2015|Ginzzu RS9 Dual, разбито стекло. Можете ли заменить?|У нас нет. Можем выполнить работу по замене.|user213@mail.ru
214|210|Андрей|03.06.2015|Добрый день. проблема с микрофоном (меня не слышат оппонент). Подскажите, сколько будет стоить замена и время работы.|Надо знать модель телефона.|user214@mail.ru
215|210|Евгений|02.06.2015|Добрый день! Необходимо в день обращения заменить дисплей на NOKIA Asha 300. Есть ли в наличии дисплей на 02.06.15г. и сколько будет общая стоимость замены.|Есть в наличии сделаем сразу, 1500.|user215@mail.ru
216|210|Vladimir|01.06.2015|добрый день!разболтался штекер зарядки на Samsung G3 (не родной - китаец) - или отошла пайка на разъеме или сам разъем накрылся - сколько будет стоить ремонт?|800 руб.|user216@mail.ru
217|210|Андрей|28.05.2015|Добрый день!Книга Kobo touch n905c. При заряде более 50% сама постоянно жмет на кнопки. Когда заряд падает жмет иногда. Проблема аппаратная, поскольку происходит это и под никелем и под андроидом. Во сколько примерно обойдется ремонт?|Надо смотреть.|user217@mail.ru
218|210|Ксения|26.05.2015|Добрый день, интересует стоимость замены сенсорного стекла (только стекла) в HTC dual sim (e802) (само стекло есть).Спасибо.|1800.|user218@mail.ru
219|210|Михаил|25.05.2015|Добрый день. Nokia Lumia 930 на экране появилось желтое пятно которое расползалось по всей площади, изменило цвета (белый на желотоватый, у других сменился оттенок). Скорее всего нужна замена экрана (всего корпуса). Будет ли такой экран в наличие на Новослободской 30.05.2015 и смогут ли поменять за день? Спасибо.|Экран есть, цена на сайте.|user219@mail.ru
220|220|Евгений|21.05.2015|Подскажите, замена кнопки питания на Lumia 925 и приклеить дисплей (от перегрева немного отошел) можно будет сделать на Проспекте мира? Стоимость также интересует.|1500.|user220@mail.ru
221|220|Никита|15.05.2015|samsung nexus 10 хочу поменять аккумулятор.есть они в наличии?? и сколько стоит акк и замена?|Есть. 2000|user221@mail.ru
222|220|Сергей|13.05.2015|день добрый! интересует ремонт Мегафон логин плюс. Разбит экран. Это возможно?|Позвоните в офис в Кузьминки. Там был такой экран.|user222@mail.ru
223|220|Андрей|13.05.2015|Добрый день!Phillips Xenium x623 не слышно собеседника в телефоне. Громкая связь и наушники работают нормально. Что можно сделать и сколько будет стоить ремонт?|Надо поменять слуховой динамик. Цена вопроса 700 руб.|user223@mail.ru
224|220|Татьяна|12.05.2015|Здравствуйте! У меня нокия 808, упал, на экране сетка, всё работает, нужна полная замена экрана или возможна замена стекла. И ещё вопрос: при наличии стекла (или экрана на складе) за сколько (по времени) можно его починить?| |user224@mail.ru
225|220|Анастасия|08.05.2015|Здравствуйте! Имеется nokia 7390 бронза. Необходима замена дисплея (на сколько я понимаю, у нее модуль из двух) и корпуса (есть проблемы с задней крышкой из-за вздутости аккумулятора, все разболталось, экран перегружается из-за отхода аккумулятора, ПО менялось на актуальное). Корпус хотелось бы такой же бронзовый. Подскажите, пожалуйста, стоимость и сроки.|Надо посмотреть. Думаю в 2000 уложимся.|user225@mail.ru
226|220|Татьяна|08.05.2015|Доброе утро!Возможна ли замена контроллера питания планшета Samsung 5210?Какая стоимость?Спасибо!|Замена контролера питания samsung 5210 составит 6000 руб.|user226@mail.ru
227|220|роман|08.05.2015|сколько стоит заменя задней панели на SONY XPERIA Z1? и есть проблемы с микрофоном и динамиком,микрофон-меня плохо слышит аппонент,динамик- тихо стал играть. телефон находится на гарантии|Отнесите по гарантии. Если там откажут, то обращайтесь.|user227@mail.ru
228|220|Евгений|06.05.2015|Добрый день, уже пользовался вашими услугами на павелецкой, все понравилось. Теперь вот xiaomi mi3 уронили, треснул дисплей и отказал тач, примерная стоимость?|У нас такого нет. Вы можете самостоятельно заказать деталь и мы вам ее поменяем.  В данном случае вам требуется модуль дисплей с сенсорным стеклом.|user228@mail.ru
229|220|Ирина|02.05.2015|Здравствуйте, сломался разъём micro USB у телефона THL W8, сколько будет стоить замена? И такой вопрос, у меня есть аппараты(xperia x10 mini pro и планшет Huawei), которые сломаны, но разъёмы вроде целы, можно ли будет использовать их в качестве доноров? и сколько будет стоить такая замена|У всех этих разъемов разные посадочные места. Замена разъема на Thl w8 обойдется в 1200 руб.|user229@mail.ru
230|230|Иван|25.04.2015|Здравствуйте, сломался разъем в power blank, он такой же как в андройде, сможете ли вы его починить? нужна лишь смена его, так как старый развалился?|Можем.|user230@mail.ru
231|230|Сергей Иванович|23.04.2015|Не видит сим-карту нокия люмия 820|Увидит. Приносите.|user231@mail.ru
232|230|Андрей|22.04.2015|Интересует стоимость замены тачскрина на модель телефона LG G2, а так же сроки ремонта.|7200. Меняется вместе с дисплеем единым модулем.|user232@mail.ru
233|230|Элеонора|21.04.2015|Добрый день.Какова стоимость замены стекла без дисплея на lenovo s960(стекло своё)Спасибо!|Такое стекло меняется вместе с дисплеем. Отдельно не меняется.|user233@mail.ru
234|230|nik|21.04.2015|добрый день делаете ли вы русификацию клавиатуры ноутбука добавление рус букв?|да|user234@mail.ru
235|230|Сергей|21.04.2015|Здравствуйте. Телефон Samsung DUOS B5702. Очень хочу привести его в рабочее состояние. При включении высвечивается ошибка BD0204EE. Возможно произошёл сбой программного обеспечения, либо выход из строя микросхемы флэш-памяти Если подлежит ремонту, то какова цена? Спасибо.|Если прошивка поможет, то 800 руб. Если нет, то денег не возьмем, так как флеш память на плате не меняем.|user235@mail.ru
236|230|Ирина|20.04.2015|Здравствуйте.Занимаетесь ли вы ремонтом планшетв iconbit? Планшет не держит заряд,хватает на 15-20мин. Один раз показал заряд -4%. В чем поломка и сколько стоит ремонт.|Аккумулятор или разъем. Цена 1500 руб.|user236@mail.ru
237|230|Ирина|09.04.2015|Добрый день!Не работает вибрация на телефоне htc one mini2Подскажите, пожалуйста, ориентировочную стоимость и срок ремонта?| |user237@mail.ru
238|230|ольга|06.04.2015|Нетбук iru? выдает ошибку при включении, можно привести к вам на диагностику?|Конечно.|user238@mail.ru
239|230|Олег|06.04.2015|Добрый день! Подскажите, пожалуйста сколько будет стоить ремонт PSP (старая модель 2006 года). В нее попала влага - и кнопки многие перестали реагировать на нажатие. Сама консоль включается, приложения запускаются но управлять невозможно.|Примерно 1000 -1200.|user239@mail.ru
240|240|Дмитрий Перепелин|05.04.2015|"Возможен ли ремонт телефона Nokia 6230i? Телефон ""перестал"" видеть SIM-карту, а также гарнитуру. Кроме того, требуется замена корпуса телефона."|Все вместе 1600.|user240@mail.ru
241|240|Валерия|25.03.2015|Скажите , пожалуйста, занимаетесь ли вы ремонтом телефонов Sony Xperia ZL (C6503).Неисправен контроллер питания и микрофон .Интересует приблизительная цена вопроса и сроки исполнения заказа.|Можем предложить поменять плату. По срокам 1 неделя.|user241@mail.ru
242|240|Александр|25.03.2015|Здравствуйте, отломилась крышка зарядки у Nokia Lumia 800.Есть ли данная зап часть в ваших сервисах (если есть то где?) Сколько по времени займёт ремонт? и сколько будет стоить?|Почти во всех наших сервисах есть эта деталь . Звоните и уточняйте по цвету.|user242@mail.ru
243|240|Konstantin|24.03.2015|Samsung Galaxy Tab4 SM-T-530 blackДобрый день!Сколько будет стоить замена дисплея+тачскрин у моего планшета? Просьба указать цену отдельно за работу и за стоиомтсь дисплея+тачскрин.|Работа 2500. Детали 7500.|user243@mail.ru
244|240|Дмитрий|24.03.2015|Asus MemoPad K001 треснул экран,сколько будет стоить ремонт?|Скорее всего треснуло сенсорное стекло. Уточните.|user244@mail.ru
245|240|мария|23.03.2015|сколько стоит ремонт разъема для зарядки в телефоне самсунг I9260? и сколько это по времени?|1200|user245@mail.ru
246|240|Олег|22.03.2015|Можно ли у Вас заменить сенсорный экран планшета мегафон логин 3 и сколько примерно это будет стоить?|3000|user246@mail.ru
247|240|Maxat Salamatov|19.03.2015|У меня китайский тел.-SAMSUNG I9305( оригинал).В телефоне только один язык - китайский. Можно ли, сделать прошивку и установить язык - русский?Сколько будет стоит такая услуга?|1200.|user247@mail.ru
248|240|Канат|18.03.2015|У меня планшет завис на логотипе Самсунг, сколько будет стоить прошивка?! ( Samsung galaxy note 10.1 n8000 )|1400.|user248@mail.ru
249|240|Василий|11.03.2015|Добрый день! Телефон BB Z10 замена дисплея (разбит) цена вместе с работой какая?|Цена указана на сайте.|user249@mail.ru
250|250|Альберт|09.03.2015|"Была проблема: ""Windows обнаружила неполадки жёсткого диска"", после этого периодические синие экраны, потом вовсе перестала загружаться система. Нужна замена жёсткого диска HDDБ сколько это будет стоить?"|Зависит от объема жесткого диска.|user250@mail.ru
251|250|Анастасия|03.03.2015|Здравствуйте.У меня такая проблема.Модель моего телефона Samsung Galaxy S3 i9300.Я удалила альбом с фото из памяти телефона.Хотелось бы их восстановить.Можете ли Вы в этом помочь?|Можно попробовать. |user251@mail.ru
252|250|Виктор|25.02.2015|Телефон htc amaze 4g,неисправен контроллер питания(не включается ни от аккумулятора,ни от зарядки).Возможен ли ремонт и если возможен,стоимость?|Возможно. Надо смотреть.|user252@mail.ru
253|250|Дмитрий|20.02.2015|Добрый день.Philips W732Подскажите пожалуйста ориентировочную стоимость ремонта - отсутствие звука в наушниках,на дисплее появляется значок наушников,громкость максимальная,звук отсутствует.Наушники исправны.|1000-1200 руб. Делается за 1 час.|user253@mail.ru
254|250|Станислав|15.02.2015|Добрый день. На Samsung galaxy S4 9502 Duos разбит монитор . У Вас возможна замена монитора в сборе? Стоимость, сроки.|На сайте указана цена. делаем в течении 1-го дня.|user254@mail.ru
255|250|Александр|14.02.2015|Здравствуйте!Абсолютно новый телефон Sony Experia C3 D2533. Треснул экран. Сколько будет стоить замена у вас? И сколько по времени это займет? Спасибо!|8000. За 3 часа.|user255@mail.ru
256|250|Елизавета|14.02.2015|Здравствуйте!У Sony Xperia ZR C5502 треснул экран,после чего перестал работать сэнсор.Сколько будет стоить ремон,сколько времени он займет и в течение какого времени будет действовать гарантия?|5800. 1 день.|user256@mail.ru
257|250|Денис|13.02.2015|видит симкарту но не ловит сеть на SONY XPIREA Z3|Надо смотреть. |user257@mail.ru
258|250|Денис|13.02.2015|сколько стоит замена платы на sony XPIRIA z3 dual и сколько ждать?гарантии есть?|10000 и ждать примерно неделю.|user258@mail.ru
259|250|Сергей|13.02.2015|Здравствуйте сколько будет стоить замена контроллера вывода изображения на самсунг galaxy note 2014 edition|3000.|user259@mail.ru
260|260|владимир|09.02.2015|Сколько стоит заменить разъём сим карты для LG 3DP920|1800|user260@mail.ru
261|260|Надя|09.02.2015|Здравствуйте. На смартфон попала вода. Просушила, через 2 недели перестал включаться. Вибрирует, когда вставляешь аккумулятор, на 2 секунды загорается экран и снова затухает. Сколько будет стоить ремонт?|1000 р.|user261@mail.ru
262|260|Антон|08.02.2015|Сколько будет стоить замена видео чипа на ноутбуке ASUS K50AD|7500|user262@mail.ru
263|260|Борис|07.02.2015|Добрый день.Подскажите сколько будет стоит замена дисплея на  телефоне philips xenium i908 и какие сроки на ремонт?Спасибо|6000. 1 день|user263@mail.ru
264|260|Андрей|06.02.2015|Здравствуйте. Требуется замена стекла и буквенной раскладки в philips xenium x503 черный. Можно ли отремонтировать на месте. Спасибо.|Замена стекла 900 р. замена клавиатуры 800.|user264@mail.ru
265|260|олег|02.02.2015|при падении согнулась рамка вокруг дисплея сможете ли вы мне ее заменить сколько будет стоить работа модель samsung galaxy s4 9506|2000.|user265@mail.ru
266|260|павел|30.01.2015|ASUS ME302KL ТРЕСНУТО СТЕКЛО И НЕТ РЕАКЦИИ НА ПРИКОСНОВЕНИЯ.ЕСТЬ ВОЗМОЖНОСТЬ ЕГО ЗАМЕНИТЬ?|7500|user266@mail.ru
267|260|Яков|29.01.2015|Добрый день. Ремонтируете ли вы телефоны Meizu?| |user267@mail.ru
268|260|Яков Сергеевич|22.01.2015|sony xperia m2 dual... нужно заменить нижнюю плату с микрофоном и вибровызовом... интересует стоимость с запчастью|2500.|user268@mail.ru
269|260|Татьяна|21.01.2015|у меня sony ericsson w300i в нем разбит экран запчасть есть. Сколько будет стоить его замена у вас?|500 руб.|user269@mail.ru
270|270|Дмитрий|15.01.2015|Сколько на сегодняшний день стит стекло оригинал на Lumia930?Даете ли вы после ремонта товарно кассовый чек нужен для отчетности в бухгалтерию.Если сдать телефон в ремонт на коломенской то через какое время он будит готов?|За денб сделаем. Цена указана на сайте. Дек кассовый даем.|user270@mail.ru
271|270|Павел|12.01.2015|Планшет самсунг n8000 перестал загружаться, сисит на заставке downloading... Do not turn off target// И так 2 дня , не выключается.|Надо смотреть. Диагностика бесплатная.|user271@mail.ru
